{"type":"config","name":"improve-ocaml-httpcats-multicore","metricName":"requests_per_sec","metricUnit":"req/s","bestDirection":"higher","target":null,"maxExperiments":12,"plateauBatches":2,"timeBudgetMinutes":90,"parallelExperiments":3}
{"run":1,"batch":0,"hypothesis":"baseline","baseCommit":"b8cef8e","candidateRef":"baseline","commit":"b8cef8e","metric":204346.99,"metrics":{"p99_latency_ms":9.51,"peak_rss_bytes":84951040,"cpu_percent":787.5,"errors":0},"status":"keep","files":[],"description":"Existing ten-domain server with parallel connection dispatch","timestamp":1787751351,"segment":0}
{"run":2,"batch":1,"hypothesis":"domain_local_accept","baseCommit":"b8cef8e","candidateRef":"3d5e5c3bf8cecec3e56a7bc5c64682e92f276e18f72043c046882c169d5eb1f0","commit":"36d1249","metric":221679.69,"metrics":{"p99_latency_ms":9.41,"peak_rss_bytes":84750336,"cpu_percent":862.69,"errors":0},"status":"runner_up","files":["servers/httpcats-multicore/main.ml"],"description":"Handle accepted connections in each accepting domain","timestamp":1787752528,"segment":0}
{"run":3,"batch":1,"hypothesis":"prebuilt_response","baseCommit":"b8cef8e","candidateRef":"de15c358741844bc9b05fac02bed08446259f27e1ec72c7b8389328fcdcb05f6","commit":"36d1249","metric":200640.63,"metrics":{"p99_latency_ms":10.38,"peak_rss_bytes":84541440,"cpu_percent":782.79,"errors":0},"status":"discard","files":["servers/httpcats-multicore/main.ml"],"description":"Reuse immutable headers and response values","timestamp":1787752528,"segment":0}
{"run":4,"batch":1,"hypothesis":"eight_domains","baseCommit":"b8cef8e","candidateRef":"94618b7343672719b327e4d1fbbf1f946ad759a0cf1a00bb6b59c0058eeff8fd","commit":"36d1249","metric":284568.97,"metrics":{"p99_latency_ms":5.24,"peak_rss_bytes":71548928,"cpu_percent":658.46,"errors":0},"status":"keep","files":["README.md","servers.json"],"description":"Reduce the declared httpcats domain count from ten to eight","timestamp":1787752528,"segment":0}
{"run":5,"batch":1,"hypothesis":"eight_domains_local_accept","baseCommit":"36d1249","candidateRef":"566abe7d1e3e592601825d64bfbad2f9b4e908c70d49e3fdea1d2d35e7f6777f","commit":"5183c4c","metric":310832.19,"metrics":{"p99_latency_ms":5.19,"peak_rss_bytes":71921664,"cpu_percent":731.52,"errors":0},"status":"keep","files":["README.md","servers/httpcats-multicore/main.ml"],"description":"Combine eight domains with domain-local accept loops","timestamp":1787753136,"segment":0}
{"run":6,"batch":2,"hypothesis":"six_domains","baseCommit":"5183c4c","candidateRef":"83850bf5935c72005c06bf0ba664b1eb242adac20700c338444c48c70bd9f9e4","commit":"5183c4c","metric":278929.84,"metrics":{"p99_latency_ms":4.38,"peak_rss_bytes":58347520,"cpu_percent":562.16,"errors":0},"status":"discard","files":["README.md","servers.json"],"description":"Reduce the domain-local accept loops from eight to six","timestamp":1787754316,"segment":0}
{"run":7,"batch":2,"hypothesis":"seven_domains","baseCommit":"5183c4c","candidateRef":"bbdbf6779185a2290daa0766e540f72ef558c2f294c18ca9dd09d92802852845","commit":"5183c4c","metric":302803.75,"metrics":{"p99_latency_ms":4.67,"peak_rss_bytes":64753664,"cpu_percent":649.46,"errors":0},"status":"discard","files":["README.md","servers.json"],"description":"Reduce the domain-local accept loops from eight to seven","timestamp":1787754316,"segment":0}
{"run":8,"batch":2,"hypothesis":"backlog_4096","baseCommit":"5183c4c","candidateRef":"3de592036211da23b2172fc7e7bd7ed6f6ce12f9d53373e3f518f3dc781dcd88","commit":"5183c4c","metric":308924.85,"metrics":{"p99_latency_ms":4.82,"peak_rss_bytes":71745536,"cpu_percent":737.38,"errors":0},"status":"discard","files":["servers/httpcats-multicore/main.ml"],"description":"Set the listen backlog to the upstream benchmark value of 4096","timestamp":1787754316,"segment":0}
{"run":9,"batch":3,"hypothesis":"nine_domains","baseCommit":"5183c4c","candidateRef":"712b86e1b72bab0c146cf5606fcc0e48e319abab9bd3aabb22240f13d1bbe6c8","commit":"43cc9f8","metric":186003.63,"metrics":{"p99_latency_ms":12.67,"peak_rss_bytes":77795328,"cpu_percent":777.37,"errors":0},"status":"discard","files":["README.md","servers.json"],"description":"Increase the domain-local accept loops from eight to nine","timestamp":1787755591,"segment":0}
{"run":10,"batch":3,"hypothesis":"minor_heap_1m","baseCommit":"5183c4c","candidateRef":"e782a02eddc14e6f9a2544cca5300058c4efff50b27e1e1cea99adb5dd9318d6","commit":"43cc9f8","metric":374169.25,"metrics":{"p99_latency_ms":4.22,"peak_rss_bytes":121995264,"cpu_percent":752.35,"errors":0},"status":"keep","files":["README.md","servers.json"],"description":"Use a one-megaword OCaml minor heap","timestamp":1787755591,"segment":0}
{"run":11,"batch":3,"hypothesis":"minor_heap_4m","baseCommit":"5183c4c","candidateRef":"04ac03c24e4d1ed1110ee92b17728757af80a69c3c60df295566ce833294c8d8","commit":"43cc9f8","metric":396189.56,"metrics":{"p99_latency_ms":3.4,"peak_rss_bytes":324927488,"cpu_percent":772.53,"errors":0},"status":"discard","files":["servers.json"],"description":"Use a four-megaword minor heap; rejected for severe peak RSS regression","timestamp":1787755591,"segment":0}
{"type":"config","name":"improve-ocaml-vif-multicore","metricName":"requests_per_sec","metricUnit":"req/s","bestDirection":"higher","target":null,"maxExperiments":10,"plateauBatches":2,"timeBudgetMinutes":90,"parallelExperiments":3}
{"run":12,"batch":0,"hypothesis":"baseline","baseCommit":"140c742","candidateRef":"baseline","commit":"140c742","metric":181466.67,"metrics":{"p99_latency_ms":3.42,"peak_rss_bytes":56639488,"cpu_percent":392.06,"errors":0},"status":"keep","files":[],"description":"Existing four-domain Vif multicore configuration","timestamp":1787756798,"segment":1}
{"run":13,"batch":1,"hypothesis":"two_domains","baseCommit":"140c742","candidateRef":"3901c6d16ad5ff0ba7eb80d2b40d4925816aa9886f02bb1cb25135072ea4aa45","commit":"a26dc50","metric":85601.14,"metrics":{"p99_latency_ms":1.27,"peak_rss_bytes":42283008,"cpu_percent":199.52,"errors":0},"status":"discard","files":["README.md","servers.json"],"description":"Reduce Vif from four to two total domains","timestamp":1787758018,"segment":1}
{"run":14,"batch":1,"hypothesis":"six_domains","baseCommit":"140c742","candidateRef":"daea20e1901683de19c14c4c41afd15a6b1313ba41ec46e76a537b2a9238bcda","commit":"a26dc50","metric":227247.7,"metrics":{"p99_latency_ms":3.79,"peak_rss_bytes":71639040,"cpu_percent":576.15,"errors":0},"status":"runner_up","files":["README.md","servers.json"],"description":"Increase Vif from four to six total domains","timestamp":1787758018,"segment":1}
{"run":15,"batch":1,"hypothesis":"eight_domains","baseCommit":"140c742","candidateRef":"2fbfbb1114c197bbbc110ccdc5854d0248da18e88fc68ce19486580e54cbc75c","commit":"a26dc50","metric":281222.19,"metrics":{"p99_latency_ms":4.65,"peak_rss_bytes":84332544,"cpu_percent":750.61,"errors":0},"status":"keep","files":["README.md","servers.json"],"description":"Increase Vif from four to eight total domains","timestamp":1787758018,"segment":1}
{"run":16,"batch":2,"hypothesis":"ten_domains","baseCommit":"a26dc50","candidateRef":"b56c16af4182f66f393f9fd6610e68f353a89f732f1ae2e8af762846cfee3086","commit":"a26dc50","metric":224929.55,"metrics":{"p99_latency_ms":8.73,"peak_rss_bytes":96100352,"cpu_percent":876.0,"errors":0},"status":"discard","files":["README.md","servers.json"],"description":"Increase Vif from eight to ten total domains","timestamp":1787759062,"segment":1}
{"run":17,"batch":2,"hypothesis":"minor_heap_1m","baseCommit":"a26dc50","candidateRef":"c2c0889e7916d377474185b6dabb99c404bcc608c546d68d46f629084e98b47e","commit":"a26dc50","metric":333074.16,"metrics":{"p99_latency_ms":3.67,"peak_rss_bytes":134029312,"cpu_percent":757.94,"errors":0},"status":"discard","files":["README.md","servers.json"],"description":"Use a one-megaword minor heap; rejected for exceeding the segment RSS limit","timestamp":1787759062,"segment":1}
{"run":18,"batch":2,"hypothesis":"backlog_4096","baseCommit":"a26dc50","candidateRef":"317584358cb7deb7f36211aa3b78c8d44b789c1353a7544b086b05897a59a038","commit":"a26dc50","metric":275029.06,"metrics":{"p99_latency_ms":5.02,"peak_rss_bytes":83628032,"cpu_percent":746.21,"errors":0},"status":"discard","files":["servers/vif-multicore/main.ml"],"description":"Set Vif's listen backlog to 4096","timestamp":1787759062,"segment":1}
{"run":19,"batch":3,"hypothesis":"minor_heap_384k","baseCommit":"a26dc50","candidateRef":"2767e2140c807a374a7858d0e8df0b2b53f24056ef5dd701932d0c12e0ad9a3d","commit":"c3d6ee1","metric":299413.94,"metrics":{"p99_latency_ms":4.25,"peak_rss_bytes":92454912,"cpu_percent":749.84,"errors":0},"status":"runner_up","files":["README.md","servers.json"],"description":"Use a 384-kiloword minor heap","timestamp":1787760305,"segment":1}
{"run":20,"batch":3,"hypothesis":"minor_heap_512k","baseCommit":"a26dc50","candidateRef":"3207fcd9672f96adb49fb25692cc553bcbed95e0ca392eddc4a9ee58c88c03d1","commit":"c3d6ee1","metric":313579.34,"metrics":{"p99_latency_ms":4.24,"peak_rss_bytes":100683776,"cpu_percent":755.34,"errors":0},"status":"runner_up","files":["README.md","servers.json"],"description":"Use a 512-kiloword minor heap","timestamp":1787760305,"segment":1}
{"run":21,"batch":3,"hypothesis":"minor_heap_640k","baseCommit":"a26dc50","candidateRef":"a41fb15c65d5ab30154041d557f1a17a1a12230d5081a52b3fc04345db1acc09","commit":"c3d6ee1","metric":322645.04,"metrics":{"p99_latency_ms":3.74,"peak_rss_bytes":108290048,"cpu_percent":759.84,"errors":0},"status":"keep","files":["README.md","servers.json"],"description":"Use a 640-kiloword minor heap","timestamp":1787760305,"segment":1}
